{
  "provider_id": "binero",
  "provider_name": "Binero",
  "provider_type": "regional_cloud",
  "updated": "2025-12-20",
  "vendor_country_id": "SE",
  "vendor_website": "https://binero.com",
  "regions": [
    {
      "region_id": "sto1",
      "region_name": "Stockholm (Vallentuna)",
      "country_id": "SE",
      "city": "Vallentuna",
      "coordinates": [59.5340, 18.0780]
    }
  ],
  "meta": {
    "source": "https://binero.com/en/datacenter/"
  }
}
