{
  "provider_id": "leaseweb",
  "provider_name": "Leaseweb",
  "provider_type": "datacenter_operator",
  "updated": "2025-12-20",
  "vendor_country_id": "NL",
  "vendor_website": "https://www.leaseweb.com",
  "regions": [
    {
      "region_id": "fra-01",
      "region_name": "Frankfurt FRA-01",
      "country_id": "DE",
      "city": "Frankfurt",
      "coordinates": [50.1709, 8.6921]
    },
    {
      "region_id": "fra-10",
      "region_name": "Frankfurt FRA-10",
      "country_id": "DE",
      "city": "Frankfurt",
      "coordinates": [50.1109, 8.6521]
    },
    {
      "region_id": "fra-14",
      "region_name": "Frankfurt FRA-14",
      "country_id": "DE",
      "city": "Frankfurt",
      "coordinates": [50.1009, 8.6221]
    },
    {
      "region_id": "ams-01",
      "region_name": "Amsterdam AMS-01",
      "country_id": "NL",
      "city": "Amsterdam",
      "coordinates": [52.3676, 4.9041]
    }
  ],
  "meta": {
    "source": "https://www.leaseweb.com/en/why-leaseweb/platform/data-centers/fra-01"
  }
}
