{
  "provider_id": "telia",
  "provider_name": "Telia",
  "provider_type": "datacenter_operator",
  "updated": "2025-12-20",
  "vendor_country_id": "SE",
  "vendor_website": "https://www.telia.fi",
  "regions": [
    {
      "region_id": "hel-pitajanmaki",
      "region_name": "Helsinki (Pitäjänmäki)",
      "country_id": "FI",
      "city": "Helsinki",
      "coordinates": [60.2242, 24.8584]
    },
    {
      "region_id": "hel-lauttasaari",
      "region_name": "Helsinki (Lauttasaari)",
      "country_id": "FI",
      "city": "Helsinki",
      "coordinates": [60.1577, 24.8778]
    },
    {
      "region_id": "lahti",
      "region_name": "Lahti",
      "country_id": "FI",
      "city": "Lahti",
      "coordinates": [60.9827, 25.6612]
    }
  ],
  "meta": {
    "source": "https://www.telia.fi/business/data-center-services/data-centers"
  }
}
