{
    "provider_id": "bulk-infrastructure",
    "provider_name": "Bulk Infrastructure",
    "provider_type": "datacenter_operator",
    "updated": "2025-12-20",
    "vendor_country_id": "NO",
    "vendor_website": "https://bulkinfrastructure.com/",
    "regions": [
        {
            "region_id": "OS-IX",
            "region_name": "Oslo Internet Exchange (OS-IX)",
            "country_id": "NO",
            "city": "Oslo",
            "coordinates": [
                59.9139,
                10.7522
            ]
        },
        {
            "region_id": "N01",
            "region_name": "N01 Data Center Campus",
            "country_id": "NO",
            "city": "Kristiansand",
            "coordinates": [
                58.1467,
                7.9956
            ]
        }
    ],
    "meta": {
        "source": "https://bulkinfrastructure.com/data-centers/locations/os-ix"
    }
}





























