{
  "provider_id": "oci",
  "provider_name": "Oracle Cloud Infrastructure",
  "provider_type": "hyperscaler",
  "updated": "2025-12-19",
  "vendor_country_id": "US",
  "vendor_website": "https://www.oracle.com/cloud/",
  "regions": [
    {
      "region_id": "us-ashburn-1",
      "region_name": "US East (Ashburn)",
      "country_id": "US",
      "city": "Ashburn",
      "coordinates": [39.0438, -77.4874]
    },
    {
      "region_id": "us-chicago-1",
      "region_name": "US Midwest (Chicago)",
      "country_id": "US",
      "city": "Chicago",
      "coordinates": [41.8781, -87.6298]
    },
    {
      "region_id": "us-phoenix-1",
      "region_name": "US West (Phoenix)",
      "country_id": "US",
      "city": "Phoenix",
      "coordinates": [33.4484, -112.0740]
    },
    {
      "region_id": "us-sanjose-1",
      "region_name": "US West (San Jose)",
      "country_id": "US",
      "city": "San Jose",
      "coordinates": [37.3382, -121.8863]
    },
    {
      "region_id": "ca-montreal-1",
      "region_name": "Canada Southeast (Montreal)",
      "country_id": "CA",
      "city": "Montreal",
      "coordinates": [45.5017, -73.5673]
    },
    {
      "region_id": "ca-toronto-1",
      "region_name": "Canada Southeast (Toronto)",
      "country_id": "CA",
      "city": "Toronto",
      "coordinates": [43.6532, -79.3832]
    },
    {
      "region_id": "mx-queretaro-1",
      "region_name": "Mexico Central (Queretaro)",
      "country_id": "MX",
      "city": "Queretaro",
      "coordinates": [20.5888, -100.3899]
    },
    {
      "region_id": "mx-monterrey-1",
      "region_name": "Mexico Northeast (Monterrey)",
      "country_id": "MX",
      "city": "Monterrey",
      "coordinates": [25.6866, -100.3161]
    },
    {
      "region_id": "eu-paris-1",
      "region_name": "France Central (Paris)",
      "country_id": "FR",
      "city": "Paris",
      "coordinates": [48.8566, 2.3522]
    },
    {
      "region_id": "eu-marseille-1",
      "region_name": "France South (Marseille)",
      "country_id": "FR",
      "city": "Marseille",
      "coordinates": [43.2965, 5.3698]
    },
    {
      "region_id": "eu-frankfurt-1",
      "region_name": "Germany Central (Frankfurt)",
      "country_id": "DE",
      "city": "Frankfurt",
      "coordinates": [50.1109, 8.6821]
    },
    {
      "region_id": "eu-milan-1",
      "region_name": "Italy Northwest (Milan)",
      "country_id": "IT",
      "city": "Milan",
      "coordinates": [45.4642, 9.1900]
    },
    {
      "region_id": "eu-turin-1",
      "region_name": "Italy North (Turin)",
      "country_id": "IT",
      "city": "Turin",
      "coordinates": [45.0703, 7.6869]
    },
    {
      "region_id": "eu-amsterdam-1",
      "region_name": "Netherlands Northwest (Amsterdam)",
      "country_id": "NL",
      "city": "Amsterdam",
      "coordinates": [52.3676, 4.9041]
    },
    {
      "region_id": "eu-madrid-1",
      "region_name": "Spain Central (Madrid)",
      "country_id": "ES",
      "city": "Madrid",
      "coordinates": [40.4168, -3.7038]
    },
    {
      "region_id": "eu-madrid-3",
      "region_name": "Spain Central (Madrid 3)",
      "country_id": "ES",
      "city": "Madrid",
      "coordinates": [40.4268, -3.6938]
    },
    {
      "region_id": "eu-stockholm-1",
      "region_name": "Sweden Central (Stockholm)",
      "country_id": "SE",
      "city": "Stockholm",
      "coordinates": [59.3293, 18.0686]
    },
    {
      "region_id": "eu-zurich-1",
      "region_name": "Switzerland North (Zurich)",
      "country_id": "CH",
      "city": "Zurich",
      "coordinates": [47.3769, 8.5417]
    },
    {
      "region_id": "uk-london-1",
      "region_name": "UK South (London)",
      "country_id": "GB",
      "city": "London",
      "coordinates": [51.5074, -0.1278]
    },
    {
      "region_id": "uk-cardiff-1",
      "region_name": "UK West (Newport)",
      "country_id": "GB",
      "city": "Newport",
      "coordinates": [51.5842, -2.9977]
    },
    {
      "region_id": "eu-jovanovac-1",
      "region_name": "Serbia Central (Jovanovac)",
      "country_id": "RS",
      "city": "Jovanovac",
      "coordinates": [43.9320, 20.9180]
    },
    {
      "region_id": "ap-sydney-1",
      "region_name": "Australia East (Sydney)",
      "country_id": "AU",
      "city": "Sydney",
      "coordinates": [-33.8688, 151.2093]
    },
    {
      "region_id": "ap-melbourne-1",
      "region_name": "Australia Southeast (Melbourne)",
      "country_id": "AU",
      "city": "Melbourne",
      "coordinates": [-37.8136, 144.9631]
    },
    {
      "region_id": "ap-hyderabad-1",
      "region_name": "India South (Hyderabad)",
      "country_id": "IN",
      "city": "Hyderabad",
      "coordinates": [17.3850, 78.4867]
    },
    {
      "region_id": "ap-mumbai-1",
      "region_name": "India West (Mumbai)",
      "country_id": "IN",
      "city": "Mumbai",
      "coordinates": [19.0760, 72.8777]
    },
    {
      "region_id": "ap-batam-1",
      "region_name": "Indonesia North (Batam)",
      "country_id": "ID",
      "city": "Batam",
      "coordinates": [1.0456, 104.0305]
    },
    {
      "region_id": "ap-osaka-1",
      "region_name": "Japan Central (Osaka)",
      "country_id": "JP",
      "city": "Osaka",
      "coordinates": [34.6937, 135.5023]
    },
    {
      "region_id": "ap-tokyo-1",
      "region_name": "Japan East (Tokyo)",
      "country_id": "JP",
      "city": "Tokyo",
      "coordinates": [35.6762, 139.6503]
    },
    {
      "region_id": "ap-singapore-1",
      "region_name": "Singapore",
      "country_id": "SG",
      "city": "Singapore",
      "coordinates": [1.3521, 103.8198]
    },
    {
      "region_id": "ap-singapore-2",
      "region_name": "Singapore West",
      "country_id": "SG",
      "city": "Singapore",
      "coordinates": [1.3421, 103.8098]
    },
    {
      "region_id": "ap-seoul-1",
      "region_name": "South Korea Central (Seoul)",
      "country_id": "KR",
      "city": "Seoul",
      "coordinates": [37.5665, 126.9780]
    },
    {
      "region_id": "ap-chuncheon-1",
      "region_name": "South Korea North (Chuncheon)",
      "country_id": "KR",
      "city": "Chuncheon",
      "coordinates": [37.8747, 127.7342]
    },
    {
      "region_id": "me-riyadh-1",
      "region_name": "Saudi Arabia Central (Riyadh)",
      "country_id": "SA",
      "city": "Riyadh",
      "coordinates": [24.7136, 46.6753]
    },
    {
      "region_id": "me-jeddah-1",
      "region_name": "Saudi Arabia West (Jeddah)",
      "country_id": "SA",
      "city": "Jeddah",
      "coordinates": [21.4858, 39.1925]
    },
    {
      "region_id": "me-abudhabi-1",
      "region_name": "UAE Central (Abu Dhabi)",
      "country_id": "AE",
      "city": "Abu Dhabi",
      "coordinates": [24.4539, 54.3773]
    },
    {
      "region_id": "me-dubai-1",
      "region_name": "UAE East (Dubai)",
      "country_id": "AE",
      "city": "Dubai",
      "coordinates": [25.2048, 55.2708]
    },
    {
      "region_id": "il-jerusalem-1",
      "region_name": "Israel Central (Jerusalem)",
      "country_id": "IL",
      "city": "Jerusalem",
      "coordinates": [31.7683, 35.2137]
    },
    {
      "region_id": "af-johannesburg-1",
      "region_name": "South Africa Central (Johannesburg)",
      "country_id": "ZA",
      "city": "Johannesburg",
      "coordinates": [-26.2041, 28.0473]
    },
    {
      "region_id": "sa-saopaulo-1",
      "region_name": "Brazil East (Sao Paulo)",
      "country_id": "BR",
      "city": "Sao Paulo",
      "coordinates": [-23.5505, -46.6333]
    },
    {
      "region_id": "sa-vinhedo-1",
      "region_name": "Brazil Southeast (Vinhedo)",
      "country_id": "BR",
      "city": "Vinhedo",
      "coordinates": [-23.0297, -46.9756]
    },
    {
      "region_id": "sa-santiago-1",
      "region_name": "Chile Central (Santiago)",
      "country_id": "CL",
      "city": "Santiago",
      "coordinates": [-33.4489, -70.6693]
    },
    {
      "region_id": "sa-valparaiso-1",
      "region_name": "Chile West (Valparaiso)",
      "country_id": "CL",
      "city": "Valparaiso",
      "coordinates": [-33.0472, -71.6127]
    },
    {
      "region_id": "sa-bogota-1",
      "region_name": "Colombia Central (Bogota)",
      "country_id": "CO",
      "city": "Bogota",
      "coordinates": [4.7110, -74.0721]
    }
  ],
  "meta": {
    "source": "https://docs.oracle.com/en-us/iaas/Content/General/Concepts/regions.htm"
  }
}
